{
  "verdict": "MIXTURE",
  "confidence_score": 0.85,
  "analysis": "**1. The Core Claim(s):**\nThe user claims that news and articles about COVID-19 are real, presenting an image and a PDF article related to the topic. This will be assessed based on the content of the provided image and PDF, and whether they align with verified information about COVID-19.\n\n**2. Evidence Breakdown:**\n*   The attached image shows a newspaper titled \"The Daily Truthseeker\" with the headline \"COVID-19 CURES: SECRET ALIEN FORMULA DISCOVRED IN ANCIENT TOMB\". It also mentions \"World Whalth Srealth Organization SILENCES Scientist Who Foun Who Found Exrectrestical Remedy - GLOBAL COVER-UP!\" and has a publication date of October 26, 2020.\n*   The PDF document is a research article titled \"COVID-19 and fake news dissemination among Malaysians \u2013 Motives and its sociodemographic correlates\" published in the International Journal of Disaster Risk Reduction. The article discusses the spread of fake news related to COVID-19 and its impact.\n\n**3. Context & Nuance:**\nThe claim is a mixture because while the research article in the PDF is a real study about COVID-19 misinformation, the image presents a fabricated and sensationalized headline about alien cures, which is not a credible source of information. The image appears to be satirical or a form of misinformation itself. The PDF, on the other hand, discusses the real issue of fake news surrounding COVID-19.\n\n**4. Red Flags & Discrepancies:**\nThe image of \"The Daily Truthseeker\" presents a clear red flag due to its outlandish claims and the questionable credibility of the source. This contrasts sharply with the academic nature of the PDF article, which analyzes the spread of COVID-19 misinformation using research methodology.",
  "multimodal_cross_check": false,
  "source_metadata": {
    "types_analyzed": [
      "text",
      "image",
      "pdf"
    ]
  },
  "grounding_citations": [
    {
      "title": "Attached Image",
      "url": "Attached Image",
      "snippet": "COVID-19 CURES:\nSECRET ALIEN FORMULA\nDISCOVRED IN ANCIENT TOMB\nCOMALE ERI\nTHE\nTHE NEW WORL\nORDER &\nYOUR HEALTH\nOUR HEALTON\n\u0432\u0438\u0432\u0430 \u043f\u0430\u043b\u0435\u043d\u0438\u0435\u0442\nWorld Whalth Srealth Organization SILENCES Scientist Who Foun\nWho Found Exrectrestical Remedy - GLOBAL COVER-UP!\nThe Daily Truthseeker\nOctober 26, 2020\nPDF"
    }
  ],
  "media_literacy": {
    "logical_fallacies": [
      "appeal to false authority",
      "misinformation"
    ],
    "tone_analysis": "The text claim is presented as a statement of fact, but the supporting image uses sensationalism and conspiracy theories, while the PDF provides a scientific perspective. This creates a mixed tone, combining elements of truth and misinformation."
  }
}